{"candidate":"1.0.0","digest":"ec72ebc8d261a1478811856b5aca39ef8c74f4aa03fea90f1f458650e7f96d56","evidence_kinds":{"code-host-protection":"assertion","control-plane-recovery":"simulated","control-plane-scale":"simulated","platform-lifecycle":"simulated","platform-update":"simulated","workload-package-acceptance":"simulated","workload-package-failure-matrix":"simulated"},"evidence_sha256":{"control-plane-recovery":"f1116472aa41391d7acc974db903c3b647fc52236a00a29cd499345d268ff892","control-plane-scale":"f76d9dd8c219154db761d2fdbfd09ca06adbe3da075f44f31ea5295a0a83ef5d","platform-lifecycle":"04760fe54b55f3d7fd03476afcf90842f89e7f01fb20418d3dd6ac8b89731244","platform-update":"0f7843974650d3e5cba3fda287013eb442f948d923a4faddd5cfaffdd5c0ea95"},"missing_gates":["approved-physical-spark-lifecycle","authenticated-encryption-drill","physical-control-host-update-recovery","physical-replacement-host-drill","physical-spark-canary-rollback","protected-code-host","protected-code-host-pr-lifecycle","signed-platform-update-manifest-evidence"],"physical_evidence_key_id":null,"physical_update_gates":{"control_host_update_recovery":false,"signed_platform_update_manifest":false,"spark_canary_and_rollback":false},"schema_version":1,"status":"blocked","workload_packages":{"agent_digest_unchanged":true,"agent_update_calls":0,"evidence_sha256":{"workload-package-acceptance":"248a14ff4caca29ec69dda2a991081009e58c981a482c087270fbdb3222c5c55","workload-package-failure-matrix":"a5535010ea218833f10d08f8ef6dfbad23bb167e72042caf57ff8b32049f4a72"},"failure_matrix":true,"missing_gates":[],"offline_release_one_rollback":true,"release_two_activated":true,"ssh_calls":0,"unapproved_release_rejected":true,"unknown_family_without_agent_update":true,"unsigned_release_rejected":true}}
